[
  {
    "name": "Champion Fighter",
    "description": "A straightforward melee combatant who excels in direct combat with heavy weapons and heavy armor. Improved criticals and remarkable athleticism make this fighter a reliable damage dealer.",
    "ruleset": "dnd5e",
    "class_id": "class:fighter",
    "subclass_id": "subclass:champion",
    "roles": [
      "tank",
      "striker"
    ],
    "race_prefs": {
      "priority": "preferred",
      "values": [
        "race:variant-human",
        "race:mountain-dwarf",
        "race:half-orc"
      ]
    },
    "background_pref": "bg:soldier",
    "stat_priority": [
      "STR",
      "CON",
      "DEX",
      "WIS",
      "CHA",
      "INT"
    ],
    "asi_priorities": [
      {
        "feat_id": "feat:great-weapon-master"
      },
      {
        "ability_id": "Strength",
        "target": 20
      },
      {
        "ability_id": "Constitution",
        "target": 18
      }
    ],
    "level_guides": [
      {
        "level": 1,
        "class_id": "class:fighter",
        "choices": {
          "class:fighter-query-fighting_style": {
            "priority": "required",
            "values": [
              "style:great-weapon-fighting"
            ]
          }
        }
      }
    ],
    "spell_prefs": null,
    "equipment_pref": {
      "prefer": [
        "two-handed"
      ],
      "avoid": [
        "Shield"
      ]
    },
    "flavor": null,
    "max_level": 20,
    "is_multiclass": false,
    "sources": [
      "phb"
    ],
    "tier_ratings": [
      {
        "level_min": 1,
        "level_max": 4,
        "rating": 3,
        "note": "Solid but simple early game"
      },
      {
        "level_min": 5,
        "level_max": 10,
        "rating": 4,
        "note": "Extra Attack and GWM online"
      },
      {
        "level_min": 11,
        "level_max": 16,
        "rating": 4,
        "note": "Third attack at 11"
      },
      {
        "level_min": 17,
        "level_max": 20,
        "rating": 3,
        "note": "Other classes scale harder at high levels"
      }
    ],
    "id": "build:champion-fighter"
  },
  {
    "name": "Thief Rogue",
    "description": "A nimble skirmisher with unmatched skill expertise. Fast Hands and Second-Story Work add tactical versatility beyond raw damage output.",
    "ruleset": "dnd5e",
    "class_id": "class:rogue",
    "subclass_id": "subclass:thief",
    "roles": [
      "striker",
      "skill_monkey"
    ],
    "race_prefs": {
      "priority": "preferred",
      "values": [
        "race:lightfoot-halfling",
        "race:variant-human",
        "race:half-elf"
      ]
    },
    "background_pref": "bg:criminal",
    "stat_priority": [
      "DEX",
      "CON",
      "WIS",
      "CHA",
      "INT",
      "STR"
    ],
    "asi_priorities": [
      {
        "ability_id": "Dexterity",
        "target": 20
      },
      {
        "feat_id": "feat:lucky"
      },
      {
        "ability_id": "Constitution",
        "target": 16
      }
    ],
    "level_guides": [
      {
        "level": 1,
        "class_id": "class:rogue",
        "choices": {}
      }
    ],
    "spell_prefs": null,
    "equipment_pref": {
      "prefer": [
        "Finesse"
      ],
      "avoid": []
    },
    "flavor": null,
    "max_level": 20,
    "is_multiclass": false,
    "sources": [
      "phb"
    ],
    "tier_ratings": [
      {
        "level_min": 1,
        "level_max": 4,
        "rating": 4,
        "note": "Expertise and Sneak Attack scale well early"
      },
      {
        "level_min": 5,
        "level_max": 10,
        "rating": 4,
        "note": "Uncanny Dodge and Evasion add durability"
      },
      {
        "level_min": 11,
        "level_max": 16,
        "rating": 3,
        "note": "Reliable Talent is great but damage plateaus"
      },
      {
        "level_min": 17,
        "level_max": 20,
        "rating": 3,
        "note": "Consistent but not flashy at high levels"
      }
    ],
    "id": "build:thief-rogue"
  },
  {
    "name": "Totem Barbarian",
    "description": "An indomitable frontline warrior who channels primal spirits for damage resistance. Bear Totem makes this barbarian incredibly hard to bring down.",
    "ruleset": "dnd5e",
    "class_id": "class:barbarian",
    "subclass_id": "subclass:path-of-the-totem-warrior",
    "roles": [
      "tank"
    ],
    "race_prefs": {
      "priority": "preferred",
      "values": [
        "race:variant-human",
        "race:half-orc",
        "race:mountain-dwarf"
      ]
    },
    "background_pref": "bg:outlander",
    "stat_priority": [
      "STR",
      "CON",
      "DEX",
      "WIS",
      "CHA",
      "INT"
    ],
    "asi_priorities": [
      {
        "feat_id": "feat:great-weapon-master"
      },
      {
        "ability_id": "Strength",
        "target": 20
      },
      {
        "ability_id": "Constitution",
        "target": 18
      }
    ],
    "level_guides": [
      {
        "level": 1,
        "class_id": "class:barbarian",
        "choices": {}
      }
    ],
    "spell_prefs": null,
    "equipment_pref": {
      "prefer": [
        "two-handed"
      ],
      "avoid": [
        "Shield"
      ]
    },
    "flavor": null,
    "max_level": 20,
    "is_multiclass": false,
    "sources": [
      "phb"
    ],
    "tier_ratings": [
      {
        "level_min": 1,
        "level_max": 4,
        "rating": 4,
        "note": "Rage and Reckless Attack are strong from level 1"
      },
      {
        "level_min": 5,
        "level_max": 10,
        "rating": 5,
        "note": "Bear Totem resistance plus Extra Attack"
      },
      {
        "level_min": 11,
        "level_max": 16,
        "rating": 4,
        "note": "Relentless Rage keeps you standing"
      },
      {
        "level_min": 17,
        "level_max": 20,
        "rating": 3,
        "note": "Rage damage falls off relative to casters"
      }
    ],
    "id": "build:totem-barbarian"
  },
  {
    "name": "Life Cleric",
    "description": "A dedicated healer who channels divine power to restore allies and endure the front lines. Heavy armor proficiency and enhanced healing make this cleric hard to ignore.",
    "ruleset": "dnd5e",
    "class_id": "class:cleric",
    "subclass_id": "domain:life",
    "roles": [
      "healer",
      "support"
    ],
    "race_prefs": {
      "priority": "preferred",
      "values": [
        "race:hill-dwarf",
        "race:variant-human",
        "race:wood-elf"
      ]
    },
    "background_pref": "bg:acolyte",
    "stat_priority": [
      "WIS",
      "CON",
      "STR",
      "DEX",
      "CHA",
      "INT"
    ],
    "asi_priorities": [
      {
        "ability_id": "Wisdom",
        "target": 20
      },
      {
        "feat_id": "feat:war-caster"
      },
      {
        "ability_id": "Constitution",
        "target": 16
      }
    ],
    "level_guides": [
      {
        "level": 1,
        "class_id": "class:cleric",
        "choices": {}
      }
    ],
    "spell_prefs": {
      "cantrips": {
        "priority": "preferred",
        "values": [
          "Sacred Flame",
          "Toll the Dead",
          "Guidance"
        ]
      },
      "spells_by_level": {
        "1": {
          "priority": "preferred",
          "values": [
            "Healing Word",
            "Shield of Faith",
            "Guiding Bolt"
          ]
        },
        "2": {
          "priority": "preferred",
          "values": [
            "Spiritual Weapon",
            "Prayer of Healing"
          ]
        },
        "3": {
          "priority": "preferred",
          "values": [
            "Spirit Guardians",
            "Revivify"
          ]
        }
      }
    },
    "equipment_pref": null,
    "flavor": null,
    "max_level": 20,
    "is_multiclass": false,
    "sources": [
      "phb"
    ],
    "tier_ratings": [
      {
        "level_min": 1,
        "level_max": 4,
        "rating": 4,
        "note": "Best early healer with heavy armor at level 1"
      },
      {
        "level_min": 5,
        "level_max": 10,
        "rating": 5,
        "note": "Spirit Guardians plus healing dominance"
      },
      {
        "level_min": 11,
        "level_max": 16,
        "rating": 4,
        "note": "Strong sustained healing and support"
      },
      {
        "level_min": 17,
        "level_max": 20,
        "rating": 4,
        "note": "High-level spells keep it relevant"
      }
    ],
    "id": "build:life-cleric"
  },
  {
    "name": "Evocation Wizard",
    "description": "A master of destructive arcane energy who sculpts area spells around allies. Potent Cantrip and Overchannel push damage output to extreme levels.",
    "ruleset": "dnd5e",
    "class_id": "class:wizard",
    "subclass_id": "subclass:evocation",
    "roles": [
      "controller",
      "striker"
    ],
    "race_prefs": {
      "priority": "preferred",
      "values": [
        "race:variant-human",
        "race:high-elf",
        "race:rock-gnome"
      ]
    },
    "background_pref": "bg:sage",
    "stat_priority": [
      "INT",
      "CON",
      "DEX",
      "WIS",
      "CHA",
      "STR"
    ],
    "asi_priorities": [
      {
        "ability_id": "Intelligence",
        "target": 20
      },
      {
        "feat_id": "feat:war-caster"
      },
      {
        "ability_id": "Constitution",
        "target": 16
      }
    ],
    "level_guides": [
      {
        "level": 1,
        "class_id": "class:wizard",
        "choices": {}
      }
    ],
    "spell_prefs": {
      "cantrips": {
        "priority": "preferred",
        "values": [
          "Fire Bolt",
          "Prestidigitation",
          "Minor Illusion"
        ]
      },
      "spells_by_level": {
        "1": {
          "priority": "preferred",
          "values": [
            "Magic Missile",
            "Shield",
            "Mage Armor",
            "Find Familiar"
          ]
        },
        "2": {
          "priority": "preferred",
          "values": [